{
  "engine": {
    "name": "video-pipeline",
    "version": "0.1.0",
    "schema_version": "0.1.0",
    "cli_entrypoint": "video-pipeline"
  },
  "steps": [
    {
      "id": "project",
      "label": "Project",
      "order": 10,
      "optional": false,
      "hint": "Scaffold the project folder + project.yml.",
      "help": "Creates the source/work/review/out/render layout and the project.yml that the later steps read defaults from. Always runs first."
    },
    {
      "id": "safezone",
      "label": "Safe Zone",
      "order": 20,
      "optional": true,
      "hint": "Derive the safe-zone spec from a template PNG.",
      "help": "Turns a design template (with the danger region marked) into the machine-readable safe-zone polygon that caption placement and QC use."
    },
    {
      "id": "reframe",
      "label": "Reframe",
      "order": 30,
      "optional": true,
      "hint": "Reframe the source to the target format.",
      "help": "Tracks the subject and crops the source to the target format — portrait, square, or landscape. Skippable when the source is already in-aspect."
    },
    {
      "id": "roughcut",
      "label": "Rough Cut",
      "order": 40,
      "optional": true,
      "hint": "Propose cuts -> editable decision file.",
      "help": "Transcribes the clip and proposes a tightened cut (drops filler, false starts, dead air) as an editable decision file you can hand-tune before rendering."
    },
    {
      "id": "caption",
      "label": "Captions",
      "order": 50,
      "optional": true,
      "hint": "Transcribe + style burned-in captions.",
      "help": "Builds glossary-corrected word-timed cues, lets you edit the caption file, and renders the styled caption overlay layer."
    },
    {
      "id": "qc",
      "label": "Safe-Zone QC",
      "order": 60,
      "optional": true,
      "hint": "Check captions/faces against the danger zone.",
      "help": "Advisory check: flags protected elements intruding on the danger polygon and captions over the speaker's face. Advises, never blocks."
    },
    {
      "id": "overlay",
      "label": "Overlays",
      "order": 65,
      "optional": true,
      "hint": "Timed/placed content overlays (image / video / source card).",
      "help": "Places content overlays — a still, a video asset, or a generated article card — on a source-time window proposed from the transcript, as an editable overlay.def. Renders the placed/timed composite and emits overlay.occupancy so captions dodge overlays and QC stays aware."
    },
    {
      "id": "composite",
      "label": "Composite",
      "order": 70,
      "optional": true,
      "hint": "Flatten the layers into one preview render.",
      "help": "Stacks the base and the caption/overlay layers into a single previewable video — the in-app preview of the assembled result and the guide track the editor handoffs carry on top. A review/handoff intermediate, not the final cut (that is yours, from your NLE)."
    },
    {
      "id": "output",
      "label": "Output / Packaging",
      "order": 80,
      "optional": true,
      "hint": "Package the project for your editor.",
      "help": "Editor handoffs: enable the target(s) you want and they run in the batch like any other step. Premiere (FCP7 XML) and Final Cut / Resolve (FCPXML) assemble the cut + caption + composite-guide tracks; CapCut gathers the rendered layers into a folder (it imports no project file)."
    }
  ],
  "tasks": [
    {
      "id": "project.init",
      "step": "project",
      "label": "Initialize project",
      "subcommand": "project-init",
      "optional": false,
      "consumes": [],
      "produces": [
        "base",
        "project"
      ],
      "io": [],
      "params": [
        {
          "key": "name",
          "type": "string",
          "arity": "positional",
          "control": "field",
          "ui": {
            "label": "Project name",
            "group": "Setup"
          },
          "order": 0,
          "required": true,
          "hint": "Project folder name.",
          "help": "Assembled to the convention \"YYYY-MM-DD <Token> Project - <Hook>\" from the fields below, so it always matches.",
          "compose": {
            "template": "{date} {token} Project - {hook}",
            "parts": [
              {
                "key": "date",
                "label": "Date",
                "control": "date",
                "default": "today"
              },
              {
                "key": "token",
                "label": "Token",
                "control": "dropdown",
                "options": [
                  "Reel",
                  "Story",
                  "Post"
                ],
                "default": "Reel",
                "hint": "Content-type token; part of the folder name and the render filename."
              },
              {
                "key": "hook",
                "label": "Hook",
                "control": "field",
                "hint": "A short description — becomes the render-file slug.",
                "placeholder": "short description"
              }
            ]
          }
        },
        {
          "key": "source",
          "type": "path",
          "arity": "value",
          "control": "picker",
          "ui": {
            "label": "Source video",
            "group": "Setup"
          },
          "flag": "--source",
          "hint": "Source video to ingest.",
          "help": "Pick the source clip. On run it is copied into the project — archived in source/ and seeded as the base layer (work/base.mp4) — so the reframe / rough-cut steps have their input. Browse or drag a file onto the field.",
          "path": {
            "kind": "file",
            "extensions": [
              "mp4",
              "mov",
              "m4v",
              "webm",
              "mkv",
              "avi"
            ]
          }
        },
        {
          "key": "identity",
          "type": "enum",
          "arity": "value",
          "control": "dropdown",
          "ui": {
            "label": "Identity",
            "group": "Setup"
          },
          "flag": "--identity",
          "default": "dyson-hope",
          "required": true,
          "options": [
            "dyson-hope",
            "jason-cook-design",
            "sigil-zero"
          ],
          "hint": "Brand/identity id for styling defaults.",
          "help": "Selects the caption style + glossary set for this creator identity (e.g. a DH or SIGIL.ZERO identity).",
          "example": "--identity dyson-hope"
        },
        {
          "key": "profile",
          "type": "enum",
          "arity": "value",
          "control": "dropdown",
          "ui": {
            "label": "Profile",
            "control": "dropdown",
            "group": "Output"
          },
          "flag": "--profile",
          "default": "reels-9x16",
          "required": true,
          "options": [
            "reels-9x16",
            "story-9x16",
            "feed-portrait-4x5",
            "feed-square-1x1",
            "feed-landscape-16x9"
          ],
          "hint": "Output aspect/dimensions preset.",
          "help": "The target frame. reels-9x16 (1080x1920) is the default for vertical Reels; the feed-* presets cover 4:5, 1:1, and 16:9. Drives crop math and safe-zone derivation.",
          "example": "--profile reels-9x16"
        },
        {
          "key": "root",
          "type": "path",
          "arity": "value",
          "control": "picker",
          "ui": {
            "label": "Projects root",
            "group": "Setup"
          },
          "flag": "--root",
          "hint": "Parent folder for projects.",
          "help": "Where the project folder is created. Defaults to ~/Video/Projects.",
          "path": {
            "kind": "directory"
          }
        },
        {
          "key": "no_trim_filler",
          "type": "bool",
          "arity": "switch",
          "control": "toggle",
          "ui": {
            "label": "Preserve filler by default",
            "control": "toggle",
            "group": "Setup"
          },
          "flag": "--no-trim-filler",
          "default": false,
          "hint": "Seed the project to preserve filler.",
          "help": "Sets the project default so rough cut keeps audio continuity (no filler/false-start trimming) unless overridden per run."
        }
      ],
      "hint": "Scaffold a new project folder.",
      "help": "Creates the project layout and project.yml. The folder name encodes date/token/hook; identity and profile seed the project defaults."
    },
    {
      "id": "safezone.gen",
      "step": "safezone",
      "label": "Generate safe-zone spec",
      "subcommand": "safezone-gen",
      "optional": false,
      "consumes": [
        "project"
      ],
      "produces": [
        "safezone.def"
      ],
      "io": [
        {
          "artifact": "safezone.def",
          "role": "output",
          "via": "flag",
          "flag": "-o"
        }
      ],
      "params": [
        {
          "key": "template",
          "type": "path",
          "arity": "positional",
          "control": "picker",
          "ui": {
            "label": "Template PNG",
            "group": "Input"
          },
          "order": 0,
          "required": true,
          "hint": "Template PNG with the danger region marked.",
          "help": "The design template image. The marked region becomes the danger polygon (notch-aware).",
          "example": "template.png",
          "path": {
            "kind": "file",
            "extensions": [
              "png",
              "jpg",
              "jpeg",
              "webp"
            ]
          }
        },
        {
          "key": "profile",
          "type": "enum",
          "arity": "value",
          "control": "dropdown",
          "ui": {
            "label": "Profile",
            "control": "dropdown",